{
  "engine_version": "ref-harness-0.4.0",
  "claim_id": "CLM-DEMO-0002",
  "evaluation_id": "EVAL-0002-v1",
  "config_versions": {
    "policy_config": "POLCFG-ILL-INDEMNITY-A@2026.1.0",
    "nme_list": "NMELIST-ILL-A@2026.1.0",
    "tariff": "TARIFF-ILL-HOSP-NW-01@2026.07",
    "checklist": "CHECKLIST-IPD-REIMB@2026.1.0",
    "engine": "ref-harness-0.4.0",
    "rules": {
      "R-GATE-IDENTITY": "1.0.0",
      "R-GATE-DATES": "1.0.0",
      "R-GATE-ITEMISATION": "1.0.0",
      "R-DOC-COMPLETENESS": "1.0.0",
      "R-ELIG-POLICY-ACTIVE": "1.0.0",
      "R-ELIG-WAITING": "1.1.0",
      "R-LINE-DUPLICATE": "1.0.0",
      "R-LINE-NONPAYABLE": "1.0.0",
      "R-LINE-TARIFF": "1.0.0",
      "R-LINE-ROOM-CAP": "1.1.0",
      "R-LINE-PROPORTIONATE": "1.1.0",
      "R-CLAIM-SUBLIMIT": "1.0.0",
      "R-CLAIM-DEDUCTIBLE": "1.0.0",
      "R-CLAIM-COPAY": "1.0.0",
      "R-CLAIM-SI-CAP": "1.0.0",
      "R-CLAIM-ROUNDING": "1.0.0",
      "R-ANOM-BILLNO-REUSE": "0.9.0"
    }
  },
  "input_hash": "sha256:f651c90c71a148e91b1237ed72f6b6f53df610ace71279c53d426fd44054fb97",
  "recommendation": {
    "type": "PAY_PARTIAL",
    "computed": true,
    "recommended_payable": "85000.00",
    "billed_total": "172455.75",
    "bill_stated_total": "172455.75",
    "itemised_lines_available": true,
    "line_level_deductions": "71570.00",
    "claim_level_deductions": "15885.75",
    "admissible_after_line_rules": "100885.75",
    "blocked_scopes": [],
    "human_decision_required": true
  },
  "lines": [
    {
      "line_id": "L01",
      "description": "Room charges - single AC",
      "category": "ROOM",
      "ward_context": "WARD",
      "billed": "18000.00",
      "payable": "9000.00",
      "fingerprint": "sha256:daf1de85b5ba1a24e8d31dbe6f42731292e4db5abf9458727e83eec179ab81d8"
    },
    {
      "line_id": "L02",
      "description": "ICU charges",
      "category": "ICU_ROOM",
      "ward_context": "ICU",
      "billed": "9000.00",
      "payable": "6000.00",
      "fingerprint": "sha256:b99856e6a55616a56a39610ea7a48d686cf110d6036a51957d9220c06818db7e"
    },
    {
      "line_id": "L03",
      "description": "Nursing charges - ward",
      "category": "NURSING",
      "ward_context": "WARD",
      "billed": "4500.00",
      "payable": "2250.00",
      "fingerprint": "sha256:577ea020c345025c9a47bcffd70db8c1c054379c69e70b2d5e6e5dc94c66a65e"
    },
    {
      "line_id": "L04",
      "description": "Nursing charges - ICU",
      "category": "NURSING",
      "ward_context": "ICU",
      "billed": "3000.00",
      "payable": "3000.00",
      "fingerprint": "sha256:22f90c77ce337969a37c09c36f41a1304626fa12b558ef3e0f6f1be97ecad488"
    },
    {
      "line_id": "L05",
      "description": "Surgeon fee - laparoscopic cholecystectomy",
      "category": "PROFESSIONAL_FEES",
      "ward_context": "WARD",
      "billed": "45000.00",
      "payable": "17500.00",
      "fingerprint": "sha256:6f16dcfce44caab058e5001eb59037efc2063adaf16b902d57ecb889281979c0"
    },
    {
      "line_id": "L06",
      "description": "Anaesthetist fee",
      "category": "PROFESSIONAL_FEES",
      "ward_context": "WARD",
      "billed": "12000.00",
      "payable": "6000.00",
      "fingerprint": "sha256:532a3c33d6bc30d2c5cabe9a5dff7b3e1ad21ff3076dafb7bb8853b6f16ab251"
    },
    {
      "line_id": "L07",
      "description": "Operation theatre charges",
      "category": "OT_CHARGES",
      "ward_context": "WARD",
      "billed": "28000.00",
      "payable": "14000.00",
      "fingerprint": "sha256:14fce1259cccd7ba28a446b4105d9bd42352f8c19e917346954c39b57f0fc354"
    },
    {
      "line_id": "L08",
      "description": "Consultant visits - ward",
      "category": "PROFESSIONAL_FEES",
      "ward_context": "WARD",
      "billed": "4000.00",
      "payable": "2000.00",
      "fingerprint": "sha256:56d6a08c62a3171f8a1143e1d8e333995cd1eb51de9ab6e25cfbbd6f0e6f3ac8"
    },
    {
      "line_id": "L09",
      "description": "Intensivist visit - ICU",
      "category": "PROFESSIONAL_FEES",
      "ward_context": "ICU",
      "billed": "2500.00",
      "payable": "2500.00",
      "fingerprint": "sha256:9153ffc1b45f361a31cdf766dd252c735e3f4dd16e03f66583dd92ccae8cdf01"
    },
    {
      "line_id": "L10",
      "description": "Pharmacy invoice PH-2291",
      "category": "PHARMACY",
      "ward_context": "WARD",
      "billed": "3420.00",
      "payable": "3420.00",
      "fingerprint": "sha256:c4f0644a229a840e6bc3f9230f14b8c3ccbec36099976588708e822f62a00c83"
    },
    {
      "line_id": "L11",
      "description": "Pharmacy invoice PH-2291",
      "category": "PHARMACY",
      "ward_context": "WARD",
      "billed": "3420.00",
      "payable": "0.00",
      "fingerprint": "sha256:c4f0644a229a840e6bc3f9230f14b8c3ccbec36099976588708e822f62a00c83"
    },
    {
      "line_id": "L12",
      "description": "Pharmacy invoice PH-2307",
      "category": "PHARMACY",
      "ward_context": "WARD",
      "billed": "11865.75",
      "payable": "11865.75",
      "fingerprint": "sha256:6d72760c50c49d97b78ff40e9d71da0bf8052bb6ee37ea2024c5c584b0e3e4a1"
    },
    {
      "line_id": "L13",
      "description": "Laparoscopic consumables",
      "category": "CONSUMABLES",
      "ward_context": "WARD",
      "billed": "14500.00",
      "payable": "14500.00",
      "fingerprint": "sha256:9a36f2123f5d051093661ff0d0d03f7147b0aabfb6530e74e7c9aeefd7cd19be"
    },
    {
      "line_id": "L14",
      "description": "CT scan abdomen (contrast)",
      "category": "DIAGNOSTICS",
      "ward_context": "WARD",
      "billed": "5500.00",
      "payable": "4000.00",
      "fingerprint": "sha256:5592bf05791240da4911a867c89d8d59d5dbaf22d369b61c8c90d155f22628c5"
    },
    {
      "line_id": "L15",
      "description": "Laboratory investigations",
      "category": "DIAGNOSTICS",
      "ward_context": "WARD",
      "billed": "4850.00",
      "payable": "4850.00",
      "fingerprint": "sha256:8e9f59c0cbc1431a110461bd8beb4f8776fe881a87ea089ec8cd31b1352746b3"
    },
    {
      "line_id": "L16",
      "description": "Television charges",
      "category": "OTHER_HOSPITAL_SERVICES",
      "ward_context": "WARD",
      "billed": "600.00",
      "payable": "0.00",
      "fingerprint": "sha256:aa4d7bde7b7fa5aa346198c76a9f69271ccb381d73f0796ea5d19b062b3ba664"
    },
    {
      "line_id": "L17",
      "description": "Telephone charges",
      "category": "OTHER_HOSPITAL_SERVICES",
      "ward_context": "WARD",
      "billed": "350.00",
      "payable": "0.00",
      "fingerprint": "sha256:3cae443480b03f63bf6012b67a7e53a18af833ec9f69508ff4ff7bc1a5fcad6d"
    },
    {
      "line_id": "L18",
      "description": "Infusion pump charges",
      "category": "OTHER_HOSPITAL_SERVICES",
      "ward_context": "WARD",
      "billed": "1800.00",
      "payable": "0.00",
      "fingerprint": "sha256:b0b21a12548e6ef1ab0dcf9abec7c129c79404123874d81b7b15c6ffdba5243a"
    },
    {
      "line_id": "L19",
      "description": "Nursing - bed pan",
      "category": "NURSING",
      "ward_context": "WARD",
      "billed": "150.00",
      "payable": "0.00",
      "fingerprint": "sha256:55237b26a907e6a966856fa57c71b8d42b204cfa896c3dc7723325eae51368f1"
    }
  ],
  "adjustments": [
    {
      "adjustment_id": "ADJ-0007",
      "level": "LINE",
      "line_id": "L11",
      "rule_id": "R-LINE-DUPLICATE",
      "rule_version": "1.0.0",
      "reason_code": "DUPLICATE_LINE",
      "amount": "3420.00",
      "engine_amount": "3420.00",
      "origin": "ENGINE",
      "override_ref": null,
      "base_before": "3420.00",
      "remaining_after": "0.00",
      "formula": "remaining (full)",
      "explanation": "Same invoice PH-2291, date and amount already billed on L10.",
      "authority": {
        "artifact": "POLCFG-ILL-INDEMNITY-A@2026.1.0",
        "doc_id": "ILL-WORDING-A-2026",
        "clause": "7.2 Expenses actually incurred"
      },
      "evidence_refs": [
        {
          "document_id": "DOC-0002-PH1-COPY",
          "page": 1,
          "bbox": [
            40,
            480,
            560,
            494
          ],
          "quote": "Pharmacy invoice PH-2291 3,420.00"
        }
      ]
    },
    {
      "adjustment_id": "ADJ-0009",
      "level": "LINE",
      "line_id": "L16",
      "rule_id": "R-LINE-NONPAYABLE",
      "rule_version": "1.0.0",
      "reason_code": "NME_NON_PAYABLE",
      "amount": "600.00",
      "engine_amount": "600.00",
      "origin": "ENGINE",
      "override_ref": null,
      "base_before": "600.00",
      "remaining_after": "0.00",
      "formula": "remaining (full)",
      "explanation": "'Television charges' matched NME-002 (Television charges); treatment DISALLOW_FULL under list NMELIST-ILL-A v2026.1.0.",
      "authority": {
        "artifact": "POLCFG-ILL-INDEMNITY-A@2026.1.0",
        "doc_id": "ILL-WORDING-A-2026",
        "clause": "4.1 Non-payable items"
      },
      "evidence_refs": [
        {
          "document_id": "DOC-0002-FB",
          "page": 3,
          "bbox": [
            40,
            168,
            560,
            182
          ],
          "quote": "Television charges 600.00"
        }
      ]
    },
    {
      "adjustment_id": "ADJ-0010",
      "level": "LINE",
      "line_id": "L17",
      "rule_id": "R-LINE-NONPAYABLE",
      "rule_version": "1.0.0",
      "reason_code": "NME_NON_PAYABLE",
      "amount": "350.00",
      "engine_amount": "350.00",
      "origin": "ENGINE",
      "override_ref": null,
      "base_before": "350.00",
      "remaining_after": "0.00",
      "formula": "remaining (full)",
      "explanation": "'Telephone charges' matched NME-003 (Telephone charges); treatment DISALLOW_FULL under list NMELIST-ILL-A v2026.1.0.",
      "authority": {
        "artifact": "POLCFG-ILL-INDEMNITY-A@2026.1.0",
        "doc_id": "ILL-WORDING-A-2026",
        "clause": "4.1 Non-payable items"
      },
      "evidence_refs": [
        {
          "document_id": "DOC-0002-FB",
          "page": 3,
          "bbox": [
            40,